{
  "schemaVersion": "reading-order-v2-input-v1",
  "pageId": "H13",
  "width": 1440,
  "height": 2048,
  "regions": [
    {
      "regionId": "ro2h-H13-r001",
      "sourceIndex": 0,
      "lines": [
        [
          [
            1120,
            420
          ],
          [
            1148,
            420
          ],
          [
            1148,
            720
          ],
          [
            1120,
            720
          ]
        ],
        [
          [
            1170,
            420
          ],
          [
            1198,
            420
          ],
          [
            1198,
            720
          ],
          [
            1170,
            720
          ]
        ]
      ],
      "angle": 0
    },
    {
      "regionId": "ro2h-H13-r002",
      "sourceIndex": 1,
      "lines": [
        [
          [
            690,
            620
          ],
          [
            718,
            620
          ],
          [
            718,
            920
          ],
          [
            690,
            920
          ]
        ],
        [
          [
            740,
            620
          ],
          [
            768,
            620
          ],
          [
            768,
            920
          ],
          [
            740,
            920
          ]
        ]
      ],
      "angle": 0
    },
    {
      "regionId": "ro2h-H13-r003",
      "sourceIndex": 2,
      "lines": [
        [
          [
            260,
            720
          ],
          [
            530,
            720
          ],
          [
            530,
            748
          ],
          [
            260,
            748
          ]
        ],
        [
          [
            260,
            774
          ],
          [
            530,
            774
          ],
          [
            530,
            802
          ],
          [
            260,
            802
          ]
        ]
      ],
      "angle": 0
    },
    {
      "regionId": "ro2h-H13-r004",
      "sourceIndex": 3,
      "lines": [
        [
          [
            300,
            1040
          ],
          [
            560,
            1040
          ],
          [
            560,
            1068
          ],
          [
            300,
            1068
          ]
        ],
        [
          [
            300,
            1094
          ],
          [
            560,
            1094
          ],
          [
            560,
            1122
          ],
          [
            300,
            1122
          ]
        ]
      ],
      "angle": 0
    }
  ]
}
